[
  {
    "id": "2026-ja-note-unsupported-unity-build-failure",
    "title": "VRChat非対応のUnity versionでBuildできず複数エラーが出る",
    "date": "2026-06-17",
    "date_kind": "published",
    "source_urls": ["https://note.com/massirooo_/n/n9fa4a5dc3d41"],
    "source_type": "article",
    "source_family": "note",
    "component": "Unity version compatibility",
    "unity_version": "unknown",
    "vrcsdk_version": "unknown",
    "packages": [{"name": "VRChat SDK", "version": "unknown"}],
    "platforms": ["unknown"],
    "stage": "build",
    "error_signature": "unknown",
    "symptom": "Buildを実行できず、複数のエラーが表示される。",
    "trigger": "VRChatが対応していないUnity versionを使用する。",
    "root_cause": "記事ではVRChatが使用可能なUnity versionを指定しており、それ以外では正常動作しない場合があるとしている。",
    "solution": "記事ではVRChat対応版のUnity 2022.3.22f1を使用するよう案内している。",
    "workaround": "unknown",
    "status": "resolved",
    "tags": ["ja", "日本語", "vrchat", "unity-version", "build", "note"]
  },
  {
    "id": "2026-ja-note-illegal-byte-sequence-japanese-pc-name",
    "title": "日本語のPC名でVRChat SDKのBuild & PublishがIllegal byte sequenceで失敗する",
    "date": "2026-06-19",
    "date_kind": "published",
    "source_urls": ["https://note.com/tonek4nata/n/n6407d00e6ddf"],
    "source_type": "article",
    "source_family": "note",
    "component": "VRChat SDK upload / host naming",
    "unity_version": "unknown",
    "vrcsdk_version": "unknown",
    "packages": [{"name": "VRChat SDK - Avatars", "version": "unknown"}],
    "platforms": ["Windows"],
    "stage": "upload",
    "error_signature": "Illegal byte sequence encounted in the input. Parameter name: string",
    "symptom": "Build & Publishを押してもアップロードが完了せず、アバター名やサムネイル設定にも失敗することがある。",
    "trigger": "WindowsのPC名（デバイス名）が日本語の状態でVRChat SDKからアバターをアップロードする。",
    "root_cause": "記事の事例では、日本語のPC名が非ASCII文字を含むネットワーク情報として扱われ、ReserveAvatarId付近でIllegal byte sequenceエラーになったとしている。",
    "solution": "PC名を英数字だけの名前へ変更してWindowsを再起動し、Unityを開き直してBuild & Publishを再実行する。記事の事例ではこれでアップロードに成功した。",
    "workaround": "unknown",
    "status": "resolved",
    "tags": ["ja", "日本語", "vrchat-sdk", "upload", "windows", "hostname", "illegal-byte-sequence", "note"]
  },
  {
    "id": "2026-ja-note-duplicate-pipeline-managers-world-upload",
    "title": "Pipeline Managerが複数あるとVRChat Worldをアップロードできない",
    "date": "2026-03-18",
    "date_kind": "published",
    "source_urls": ["https://note.com/kasugai_toru/n/n9150eba55357"],
    "source_type": "article",
    "source_family": "note",
    "component": "VRChat World Pipeline Manager",
    "unity_version": "unknown",
    "vrcsdk_version": "unknown",
    "packages": [{"name": "VRChat SDK - Worlds", "version": "unknown"}],
    "platforms": ["unknown"],
    "stage": "upload",
    "error_signature": "You can only have a single...",
    "symptom": "VRChat Worldのbuild/uploadがSDKに拒否される。",
    "trigger": "既存のPipeline Managerに加えて、読み込んだAsset内のサンプルPipeline ManagerもHierarchyに存在する。",
    "root_cause": "記事では同一SceneにPipeline Managerが2つ存在することを原因としている。",
    "solution": "SDKのSelect all PipelineManagersで対象を選択し、重複しているPipeline Managerの片方を削除する。記事ではこれでアップロード可能になった。",
    "workaround": "unknown",
    "status": "resolved",
    "tags": ["ja", "日本語", "vrchat-world", "pipeline-manager", "upload", "duplicate", "note"]
  },
  {
    "id": "2026-ja-note-avatar-bounds-culling-disappears",
    "title": "Skinned MeshのBoundsが小さいと視点や姿勢によって髪や衣装が消える",
    "date": "2026-04-25",
    "date_kind": "published",
    "source_urls": ["https://note.com/nasaw/n/n683b072d1a40"],
    "source_type": "article",
    "source_family": "note",
    "component": "avatar rendering bounds",
    "unity_version": "unknown",
    "vrcsdk_version": "unknown",
    "packages": [{"name": "VRChat avatar", "version": "unknown"}],
    "platforms": ["unknown"],
    "stage": "runtime",
    "error_signature": "unknown",
    "symptom": "相手を視野の端から見たり姿勢が変わった時に、髪や衣装の一部が消えたままになる。",
    "trigger": "変形後の髪や衣装がSkinned Mesh RendererのBounds外へ移動し、見る側の視野からBoundsが外れる。",
    "root_cause": "記事ではBoundsが実際の変形範囲を十分に覆っていないためカリングされることを原因としている。",
    "solution": "通常の動作範囲を覆うようBoundsを広げる。記事ではModular AvatarのMA Mesh Settingsも修正手段として挙げている。",
    "workaround": "unknown",
    "status": "resolved",
    "tags": ["ja", "日本語", "avatar", "bounds", "culling", "rendering", "modular-avatar", "note"]
  },
  {
    "id": "2026-ja-note-editoronly-clothing-missing-after-build",
    "title": "EditorOnlyタグの衣装はUnity上で見えてもVRChat build後に消える",
    "date": "2026-04-25",
    "date_kind": "published",
    "source_urls": ["https://note.com/nasaw/n/n683b072d1a40"],
    "source_type": "article",
    "source_family": "note",
    "component": "avatar hierarchy / EditorOnly",
    "unity_version": "unknown",
    "vrcsdk_version": "unknown",
    "packages": [{"name": "VRChat avatar", "version": "unknown"}],
    "platforms": ["unknown"],
    "stage": "build",
    "error_signature": "unknown",
    "symptom": "Unity Editor上では衣装が見えているが、buildしてVRChatへ入ると衣装が存在しない。",
    "trigger": "衣装などのGameObjectにEditorOnlyタグを付けたままbuildする。",
    "root_cause": "記事では対象GameObjectがEditorOnlyタグのままになっていることを原因としている。",
    "solution": "対象GameObjectのタグをEditorOnlyから通常のタグへ戻し、Play ModeとVRChat上で確認する。",
    "workaround": "unknown",
    "status": "resolved",
    "tags": ["ja", "日本語", "avatar", "editoronly", "clothing", "build", "note"]
  },
  {
    "id": "2026-ja-note-vrm1-unsupported-vrm-converter",
    "title": "VRM1.0をVRM Converter for VRChatへ入れても変換されない",
    "date": "2026-07-03",
    "date_kind": "published",
    "source_urls": ["https://note.com/rogue_engineer/n/n1d21d7184a62"],
    "source_type": "article",
    "source_family": "note",
    "component": "VRM Converter for VRChat import",
    "unity_version": "unknown",
    "vrcsdk_version": "unknown",
    "packages": [{"name": "VRM Converter for VRChat", "version": "unknown"}],
    "platforms": ["Windows 11 Pro"],
    "stage": "import",
    "error_signature": "unknown",
    "symptom": "VRMファイルをUnity EditorのAssetsへ入れてもVRChat向けアバターへ変換できない。",
    "trigger": "VRoid StudioからVRM0.0ではなくVRM1.0でエクスポートしたファイルをVRM Converter for VRChatへ渡す。",
    "root_cause": "記事の事例ではVRM1.0が使用中のVRM Converter for VRChatで対応していない形式だった。",
    "solution": "VRoid StudioからVRM0.0形式でエクスポートし直し、VRM Converter for VRChatで変換する。",
    "workaround": "unknown",
    "status": "resolved",
    "tags": ["ja", "日本語", "vrm", "vroid", "vrm-converter-for-vrchat", "import", "note"]
  },
  {
    "id": "2026-ja-note-physbone-no-endpoint-not-moving",
    "title": "末端ボーンもEndpoint PositionもないPhysBoneがVRChatで揺れない",
    "date": "2026-01-27",
    "date_kind": "published",
    "source_urls": ["https://note.com/oyajik/n/n584365cc6b93"],
    "source_type": "article",
    "source_family": "note",
    "component": "VRC PhysBone endpoint / bone structure",
    "unity_version": "2022.3.22f1",
    "vrcsdk_version": "unknown",
    "packages": [{"name": "VRChat SDK - Avatars", "version": "unknown"}],
    "platforms": ["unknown"],
    "stage": "runtime",
    "error_signature": "unknown",
    "symptom": "VRC PhysBoneを設定してアップロードしても対象ボーンが全く揺れず、VRChatのPhysBones overlayでも期待した反映を確認できない。",
    "trigger": "単一の末端側ボーンへPhysBoneを設定したが、その先に末端ボーンがなくEndpoint Positionも設定されていない。",
    "root_cause": "記事の事例ではPhysBoneが動作するための末端位置を定義するボーンまたはEndpoint Positionが不足していた。",
    "solution": "VRC PhysBoneのEndpoint Positionを設定するか、モデル側に末端ボーンを追加してFBXを再出力する。記事ではどちらの方法でもVRChat上でPhysBoneの反映を確認している。",
    "workaround": "unknown",
    "status": "resolved",
    "tags": ["ja", "日本語", "vrchat", "physbone", "endpoint", "bone", "unity-2022.3.22f1", "note"]
  },
  {
    "id": "2026-ja-note-physbone-insufficient-bone-chain-not-grabbable",
    "title": "PhysBoneのボーン構造が不足していると揺れても掴めない",
    "date": "2026-01-27",
    "date_kind": "published",
    "source_urls": ["https://note.com/oyajik/n/n584365cc6b93"],
    "source_type": "article",
    "source_family": "note",
    "component": "VRC PhysBone grab / bone structure",
    "unity_version": "2022.3.22f1",
    "vrcsdk_version": "unknown",
    "packages": [{"name": "VRChat SDK - Avatars", "version": "unknown"}],
    "platforms": ["unknown"],
    "stage": "runtime",
    "error_signature": "unknown",
    "symptom": "PhysBoneは揺れるがVRChat上で掴んで伸ばすことができない。",
    "trigger": "掴ませたいPhysBoneのボーンチェーンに、掴んで伸びる先として使える追加ボーンがない。",
    "root_cause": "記事の事例では掴む動作に必要なボーン構造が不足していた。",
    "solution": "Blenderなどで対象ボーンの子ボーンを追加し、追加ボーンへウェイトを設定してFBXをUnityへ戻す。記事では再アップロード後に掴んで伸ばせることを確認している。",
    "workaround": "unknown",
    "status": "resolved",
    "tags": ["ja", "日本語", "vrchat", "physbone", "grab", "bone", "unity-2022.3.22f1", "note"]
  }
]
