[
  {
    "id": "2026-ask-sdk-3104-tags-null-upload",
    "title": "Avatar upload fails on SDK 3.10.4 when no avatar tags are set",
    "date": "2026-08-01",
    "date_kind": "published",
    "source_urls": ["https://ask.vrchat.com/t/avatar-succeeds-test-builds-with-no-errors-but-fails-actual-upload-builds/48766"],
    "source_type": "forum",
    "source_family": "VRChat Ask Forum",
    "component": "VRChat avatar upload tags",
    "unity_version": "2022.3.22f1",
    "vrcsdk_version": "3.10.4",
    "packages": [{"name": "VRChat SDK - Avatars", "version": "3.10.4"}],
    "platforms": ["PC"],
    "stage": "upload",
    "error_signature": "tags must be an array: null, tags must be a string: 'null'",
    "symptom": "Avatar test builds succeed, but the actual upload fails while creating/updating the avatar metadata.",
    "trigger": "Upload an avatar with VRChat SDK 3.10.4 without setting any avatar tag.",
    "root_cause": "The forum identifies this as a known SDK 3.10.4 bug in the tags upload path.",
    "solution": "Set at least one avatar tag before uploading. The linked VRChat Feedback report marks the bug as available in a future release.",
    "workaround": "Set any avatar tag before upload.",
    "status": "workaround",
    "tags": ["forum", "vrcsdk-3.10.4", "upload", "tags", "ask"]
  },
  {
    "id": "2026-ask-android-build-support-reinstall",
    "title": "Quest avatar build fails until Android Build Support is reinstalled",
    "date": "2026-06-17",
    "date_kind": "published",
    "source_urls": ["https://ask.vrchat.com/t/cant-build-even-though-there-is-no-errors/48592"],
    "source_type": "forum",
    "source_family": "VRChat Ask Forum",
    "component": "Android Build Support",
    "unity_version": "2022.3.22f1",
    "vrcsdk_version": "unknown",
    "packages": [{"name": "VRChat SDK - Avatars", "version": "unknown"}, {"name": "Unity Android Build Support", "version": "2022.3.22f1"}],
    "platforms": ["Android"],
    "stage": "build",
    "error_signature": "Error building Player because scripts had compiler errors",
    "symptom": "The same project can build for Windows but Android/Quest builds fail, including VRChat's example avatar in a new project.",
    "trigger": "Build the avatar for Android while the local Unity Android Build Support installation is in the failing state documented by the thread.",
    "root_cause": "The field report isolates the Android Build Support installation state: Android builds failed even for the SDK example avatar, and reinstalling the module resolved the failure.",
    "solution": "Reinstall Android Build Support for Unity 2022.3.22f1 in Unity Hub, then retry the Android build.",
    "workaround": "unknown",
    "status": "resolved",
    "tags": ["forum", "android", "quest", "build-support", "ask"]
  },
  {
    "id": "2026-feedback-contact-box-size-dropped-on-old-sdk-import",
    "title": "Contact Receiver Box Size is dropped when a package is imported before SDK 3.10.4",
    "date": "2026-06-16",
    "date_kind": "published",
    "source_urls": ["https://feedback.vrchat.com/sdk-bug-reports/p/creator-companion-beta-bug-unity-export-missing-parameters"],
    "source_type": "forum",
    "source_family": "VRChat Feedback",
    "component": "VRC Contact Receiver serialization",
    "unity_version": "unknown",
    "vrcsdk_version": "<3.10.4",
    "packages": [{"name": "VRChat SDK - Avatars", "version": "<3.10.4"}],
    "platforms": ["unknown"],
    "stage": "package import / upgrade",
    "error_signature": "unknown",
    "symptom": "A Box-shaped VRC Contact Receiver loses its Size value after a package is imported into an older SDK project and that project is later upgraded.",
    "trigger": "Import a package containing Box Contact Receiver data into an SDK version that does not recognize the Box fields, then upgrade to SDK 3.10.4 or later.",
    "root_cause": "VRChat staff explains that Unity drops serialized component data that the installed SDK version does not recognize; Box contacts became available in SDK 3.10.4.",
    "solution": "Upgrade to SDK 3.10.4 or later before importing the package. If it was already imported into an older SDK, re-import it after upgrading.",
    "workaround": "unknown",
    "status": "resolved",
    "tags": ["vrchat-feedback", "contact-receiver", "serialization", "sdk-version", "package-import"]
  },
  {
    "id": "2026-feedback-incomplete-avatar-blocks-upload",
    "title": "Incomplete failed avatar state can keep later avatar uploads from completing",
    "date": "2026-01-15",
    "date_kind": "published",
    "source_urls": ["https://feedback.vrchat.com/sdk-bug-reports/p/avatar-upload-is-not-completing"],
    "source_type": "forum",
    "source_family": "VRChat Feedback",
    "component": "VRChat avatar upload state",
    "unity_version": "unknown",
    "vrcsdk_version": "3.9.0 / 3.10.1",
    "packages": [{"name": "VRChat SDK - Avatars", "version": "3.9.0 / 3.10.1"}],
    "platforms": ["unknown"],
    "stage": "upload",
    "error_signature": "unknown",
    "symptom": "Avatar upload does not complete after Avatar Uploading and Signature Uploading; a failed avatar may remain visible on the website but unavailable in VRChat.",
    "trigger": "Retry uploads while an earlier avatar upload remains in an incomplete/inconsistent server-side state.",
    "root_cause": "The reporter's final resolution identifies an inconsistency associated with an avatar that had not finished uploading.",
    "solution": "Delete the failed/incomplete avatar entry and retry the upload.",
    "workaround": "unknown",
    "status": "resolved",
    "tags": ["vrchat-feedback", "avatar-upload", "incomplete-state", "server-state"]
  },
  {
    "id": "2026-feedback-local-world-multiclient-black-screen",
    "title": "Second and later local world test clients can freeze on a black screen",
    "date": "2026-06-05",
    "date_kind": "published",
    "source_urls": ["https://feedback.vrchat.com/sdk-bug-reports/p/1854-in-local-world-testing-launching-multiple-clients-causes-the-second-and-sub"],
    "source_type": "forum",
    "source_family": "VRChat Feedback",
    "component": "World Build & Test multi-client",
    "unity_version": "unknown",
    "vrcsdk_version": "unknown",
    "packages": [{"name": "VRChat SDK - Worlds", "version": "unknown"}],
    "platforms": ["PC"],
    "stage": "local test",
    "error_signature": "unknown",
    "symptom": "During local multi-client world testing, the second and subsequent clients can freeze on a black screen; some rejoin attempts can also crash repeatedly.",
    "trigger": "Launch multiple local Build & Test clients for the same world.",
    "root_cause": "unknown",
    "solution": "unknown",
    "workaround": "Set VRChat debug logging to Full; a related report's workaround is confirmed by a commenter on this tracked report.",
    "status": "workaround",
    "tags": ["vrchat-feedback", "world", "build-and-test", "multi-client", "black-screen"]
  },
  {
    "id": "2026-feedback-constraint-stale-physbone-reference",
    "title": "VRC Constraint can throw MissingReferenceException after a monitored PhysBone is removed",
    "date": "2026-02-11",
    "date_kind": "observed",
    "source_urls": ["https://feedback.vrchat.com/sdk-bug-reports/p/vrcconstraintsbaseonenable-produces-missingreferenceexception-checking-execution"],
    "source_type": "forum",
    "source_family": "VRChat Feedback",
    "component": "VRC Constraint / PhysBone dependency",
    "unity_version": "unknown",
    "vrcsdk_version": "3.10.2-beta.1",
    "packages": [{"name": "VRChat SDK - Avatars", "version": "3.10.2-beta.1"}],
    "platforms": ["unknown"],
    "stage": "editor",
    "error_signature": "MissingReferenceException: The object of type 'VRCPhysBone' has been destroyed but you are still trying to access it.",
    "symptom": "Enabling objects, prefab override operations, undo/redo, or related editor actions can repeatedly throw MissingReferenceException from VRCConstraintBase when stale PhysBone references remain.",
    "trigger": "A VRC Constraint has monitored a PhysBone that is later removed, leaving missing references in its monitored PhysBones data.",
    "root_cause": "unknown",
    "solution": "unknown",
    "workaround": "Inspect the constraint in Debug mode for missing monitored PhysBone references; recreating the affected constraint clears the stale reference in the reported workflow.",
    "status": "workaround",
    "tags": ["vrchat-feedback", "constraint", "physbone", "missingreferenceexception", "prefab"]
  }
]
