[
  {
    "id": "2026-ja-zenn-vrchat-missing-credentials",
    "title": "VRChat SDKで「Missing Credentials」が出る",
    "date": "2026-01-19",
    "date_kind": "published",
    "source_urls": ["https://zenn.dev/yrd_gs/articles/b123e9fee91ff9"],
    "source_type": "article",
    "source_family": "Zenn",
    "component": "VRChat SDK authentication",
    "unity_version": "unknown",
    "vrcsdk_version": "unknown",
    "packages": [{"name": "VRChat SDK", "version": "unknown"}],
    "platforms": ["unknown"],
    "stage": "setup",
    "error_signature": "Missing Credentials",
    "symptom": "VRChat SDKで認証情報不足を示すエラーが表示される。",
    "trigger": "記事では、Authenticationタブ上ではログイン済みに見える状態で発生している。",
    "root_cause": "unknown",
    "solution": "unknown",
    "workaround": "VRChat SDKのAuthenticationタブでLogoutし、VRChatアカウントへ再ログインする。記事では必要に応じてプロジェクトのキャッシュ類を削除する手順も記録している。",
    "status": "workaround",
    "tags": ["ja", "日本語", "vrchat", "authentication", "missing-credentials", "zenn"]
  },
  {
    "id": "2026-ja-zenn-unity-license-error",
    "title": "Unityの「License error」でプロジェクトを開けない",
    "date": "2026-01-19",
    "date_kind": "published",
    "source_urls": ["https://zenn.dev/yrd_gs/articles/f2b2b3b1baf352"],
    "source_type": "article",
    "source_family": "Zenn",
    "component": "Unity license activation",
    "unity_version": "unknown",
    "vrcsdk_version": "unknown",
    "packages": [{"name": "Unity Hub", "version": "unknown"}],
    "platforms": ["Windows", "macOS"],
    "stage": "launch",
    "error_signature": "License error",
    "symptom": "Unityのライセンスエラーによりプロジェクトを開けない。",
    "trigger": "記事の事例ではUnity_lic.ulfライセンスファイルが存在しない状態。",
    "root_cause": "記事ではUnity_lic.ulfが存在しないことを原因としている。",
    "solution": "Unity HubのLicense設定からPersonalライセンスを再取得し、Unity_lic.ulfが生成されたことを確認する。記事では生成されない場合にUnity Editorをアンインストールしてから再取得・再インストールした事例も記録している。",
    "workaround": "unknown",
    "status": "resolved",
    "tags": ["ja", "日本語", "unity", "license", "unity-hub", "zenn"]
  },
  {
    "id": "2026-ja-note-liltoon-include-file-missing",
    "title": "lilToonのincludeファイルを開けずプロジェクト全体がマゼンタになる",
    "date": "2026-02-28",
    "date_kind": "published",
    "source_urls": ["https://note.com/rainfall_mavesan/n/n7f53e36218ca"],
    "source_type": "article",
    "source_family": "note",
    "component": "lilToon shader include",
    "unity_version": "unknown",
    "vrcsdk_version": "unknown",
    "packages": [{"name": "lilToon", "version": "unknown"}],
    "platforms": ["unknown"],
    "stage": "compile",
    "error_signature": "Couldn't open include file 'lil_vert_encryption.hlsl'",
    "symptom": "lilToonのHLSL includeを開けないエラーが繰り返され、プロジェクト内の描画オブジェクトがマゼンタのエラー表示になる。",
    "trigger": "記事ではpackageインポート後にlilToon内のファイル参照が壊れた状態で発生した。",
    "root_cause": "unknown",
    "solution": "記事ではVCCのManage ProjectからlilToonを削除して再追加し、マテリアルにlilToonを再指定して復旧している。",
    "workaround": "unknown",
    "status": "resolved",
    "tags": ["ja", "日本語", "liltoon", "shader", "hlsl", "magenta", "note"]
  },
  {
    "id": "2026-ja-note-modular-avatar-outside-avatar-hierarchy",
    "title": "Modular Avatarで「アバター内に配置する必要があります」と表示される",
    "date": "2026-03-26",
    "date_kind": "published",
    "source_urls": ["https://note.com/neruneko_dayo/n/n1f837ef08fac"],
    "source_type": "article",
    "source_family": "note",
    "component": "Modular Avatar hierarchy validation",
    "unity_version": "unknown",
    "vrcsdk_version": "unknown",
    "packages": [{"name": "Modular Avatar", "version": "unknown"}],
    "platforms": ["unknown"],
    "stage": "validation",
    "error_signature": "このコンポーネントを正しく動作させるにはアバター内に配置する必要があります",
    "symptom": "Modular Avatarコンポーネントに、アバター内へ配置する必要があるという警告が表示される。",
    "trigger": "記事の事例では小道具がアバターのHierarchy配下に入っていなかった。",
    "root_cause": "記事の事例では対象オブジェクトがアバター階層の外に配置されていた。",
    "solution": "対象の小道具をHierarchy上でアバターの子になる位置へ移動し、警告が消えることを確認する。",
    "workaround": "unknown",
    "status": "resolved",
    "tags": ["ja", "日本語", "modular-avatar", "hierarchy", "validation", "note"]
  },
  {
    "id": "2026-ja-note-vrc-avatar-descriptor-missing-builder",
    "title": "VRChat SDKのBuilderにアバターが表示されない",
    "date": "2026-05-24",
    "date_kind": "published",
    "source_urls": ["https://note.com/tsukir/n/nf8cf26093b97"],
    "source_type": "article",
    "source_family": "note",
    "component": "VRChat SDK Builder",
    "unity_version": "unknown",
    "vrcsdk_version": "unknown",
    "packages": [{"name": "VRChat SDK - Avatars", "version": "unknown"}],
    "platforms": ["unknown"],
    "stage": "setup",
    "error_signature": "unknown",
    "symptom": "VRChat SDKのBuilderにHierarchy上のアバターが表示されない。",
    "trigger": "記事ではVRC Avatar Descriptorが設定されていない場合を原因候補として挙げている。",
    "root_cause": "unknown",
    "solution": "アバタールートのInspectorにVRC Avatar Descriptorがあるか確認し、配布物の説明書上必要なのに無い場合はAdd Componentから追加する。",
    "workaround": "unknown",
    "status": "workaround",
    "tags": ["ja", "日本語", "vrchat-sdk", "avatar-descriptor", "builder", "note"]
  },
  {
    "id": "2026-ja-note-missing-script-prerequisite-package",
    "title": "配布ギミックに「Missing (Mono Script)」が出る",
    "date": "2026-07-19",
    "date_kind": "published",
    "source_urls": ["https://note.com/litalita9764/n/n071c8aa34fdc"],
    "source_type": "article",
    "source_family": "note",
    "component": "Unity missing script",
    "unity_version": "unknown",
    "vrcsdk_version": "unknown",
    "packages": [{"name": "Modular Avatar", "version": "unknown"}],
    "platforms": ["PC"],
    "stage": "import",
    "error_signature": "Missing (Mono Script)",
    "symptom": "unitypackageをインポートした後、PrefabのInspectorで複数のMono ScriptがMissing表示になる。",
    "trigger": "記事の事例ではModular Avatarを前提とするギミックを、Modular Avatarが入っていないプロジェクトへインポートした。",
    "root_cause": "記事の事例では前提パッケージのModular Avatarがプロジェクトに入っていなかった。",
    "solution": "VCCのManage ProjectからModular Avatarを追加し、Missing表示だったMA Menu Installer、MA Merge Animator、MA Parametersが復元されることを確認する。",
    "workaround": "unknown",
    "status": "resolved",
    "tags": ["ja", "日本語", "missing-script", "modular-avatar", "unitypackage", "note"]
  },
  {
    "id": "2026-ja-note-quest-avatar-audio-source-removed",
    "title": "Quest版アバターで音ギミックのAudio Sourceが除去され音が鳴らない",
    "date": "2026-07-19",
    "date_kind": "published",
    "source_urls": [
      "https://note.com/litalita9764/n/n071c8aa34fdc",
      "https://creators.vrchat.com/avatars/avatar-performance-ranking-system/"
    ],
    "source_type": "article",
    "source_family": "note",
    "component": "VRChat Android avatar audio",
    "unity_version": "unknown",
    "vrcsdk_version": "unknown",
    "packages": [{"name": "VRChat SDK - Avatars", "version": "unknown"}],
    "platforms": ["Android / Quest"],
    "stage": "runtime",
    "error_signature": "The following component types are found on the Avatar and will be removed by the client: VRCSpatialAudioSource, Audio Source",
    "symptom": "Quest版ではメニューやアニメーションは動作しても、アバター上の音ギミックが無音になる。",
    "trigger": "Android / Quest向けアバターにAudio SourceまたはVRCSpatialAudioSourceを含める。",
    "root_cause": "2026年のVRChat公式Performance Ranksでは、モバイルアバターのAudio Sourcesは無効化・除去される対象として記載されている。",
    "solution": "unknown",
    "workaround": "アバター側の音源を前提にせず、必要ならワールド側で音を出す設計にする。",
    "status": "workaround",
    "tags": ["ja", "日本語", "vrchat", "quest", "android", "audio-source", "compatibility", "note"]
  }
]
